{
  "fingerprint": "bb3699cbe41260b76a64e24ff6204236768f6a5c",
  "schemaVersion": 1,
  "visualDirection": {
    "tone": "industrial_civic_synara",
    "lowChromeHUD": true,
    "keepCenterAndLowerMiddleClear": true,
    "motionSettingId": "reduced_motion",
    "flashSettingId": "reduced_flash"
  },
  "inputContexts": [
    {"id": "ui.menu", "assetPath": "/Game/UI/Input/IMC_UI_Menu", "priority": 100},
    {"id": "ui.city", "assetPath": "/Game/UI/Input/IMC_UI_City", "priority": 80},
    {"id": "ui.founder", "assetPath": "/Game/UI/Input/IMC_UI_Founder", "priority": 80},
    {"id": "ui.command", "assetPath": "/Game/UI/Input/IMC_UI_Command", "priority": 90},
    {"id": "ui.world_map", "assetPath": "/Game/UI/Input/IMC_UI_WorldMap", "priority": 90}
  ],
  "screens": [
    {"id":"main_menu","displayName":"Main Menu","assetPath":"/Game/UI/Screens/WBP_MainMenu","widgetClass":"/Script/DominionUI.DAGrayboxScreenWidget","layer":"menu","inputContextId":"ui.menu","inputMode":"ui_only","entryFocusTarget":"button.new_campaign","backTarget":"__exit__","dataChannels":[],"campaignCriticalActions":["campaign.new","ui.back"]},
    {"id":"new_campaign","displayName":"New Campaign","assetPath":"/Game/UI/Screens/WBP_NewCampaign","widgetClass":"/Script/DominionUI.DAGrayboxScreenWidget","layer":"menu","inputContextId":"ui.menu","inputMode":"ui_only","entryFocusTarget":"button.confirm_new_campaign","backTarget":"main_menu","dataChannels":["campaign.creation_options"],"campaignCriticalActions":["campaign.confirm_new","ui.back"]},
    {"id":"settings","displayName":"Settings","assetPath":"/Game/UI/Screens/WBP_Settings","widgetClass":"/Script/DominionUI.DAGrayboxScreenWidget","layer":"menu","inputContextId":"ui.menu","inputMode":"ui_only","entryFocusTarget":"tab.gameplay","backTarget":"main_menu","dataChannels":["settings.current"],"campaignCriticalActions":["settings.apply","ui.back"]},
    {"id":"accessibility","displayName":"Accessibility","assetPath":"/Game/UI/Screens/WBP_Accessibility","widgetClass":"/Script/DominionUI.DAGrayboxScreenWidget","layer":"menu","inputContextId":"ui.menu","inputMode":"ui_only","entryFocusTarget":"option.text_scale","backTarget":"settings","dataChannels":["accessibility.persisted_settings"],"campaignCriticalActions":["accessibility.apply","ui.back"]},
    {"id":"pause","displayName":"Pause","assetPath":"/Game/UI/Screens/WBP_Pause","widgetClass":"/Script/DominionUI.DAGrayboxScreenWidget","layer":"modal","inputContextId":"ui.menu","inputMode":"ui_only","entryFocusTarget":"button.resume","backTarget":"__exit__","dataChannels":["campaign.save_status"],"campaignCriticalActions":["campaign.resume","ui.back"]},
    {"id":"city_hud","displayName":"City HUD","assetPath":"/Game/UI/HUD/WBP_CityHUD","widgetClass":"/Script/DominionUI.DACityHUDWidget","layer":"hud","inputContextId":"ui.city","inputMode":"game_and_ui","entryFocusTarget":"tray.card_hand","backTarget":"__exit__","dataChannels":["wallets.capital","wallets.insight","wallets.influence","population","synara.dependency","deck.hand","quest.objective"],"campaignCriticalActions":["city.card_previous","city.card_next","city.select_card","city.place_building","city.cancel_build","ui.open_founder","ui.open_world_map","ui.tactical_pause","ui.overlay.power","ui.overlay.water","ui.overlay.data","ui.overlay.employment","ui.overlay.housing","ui.overlay.happiness","ui.overlay.dependency","ui.overlay.adjacency","ui.back"]},
    {"id":"founder_hud","displayName":"Founder HUD","assetPath":"/Game/UI/HUD/WBP_FounderHUD","widgetClass":"/Script/DominionUI.DAFounderHUDWidget","layer":"hud","inputContextId":"ui.founder","inputMode":"game_only","entryFocusTarget":"world.founder","backTarget":"__exit__","dataChannels":["founder.health","founder.guard","founder.stamina","founder.abilities","founder.interaction","quest.objective"],"campaignCriticalActions":["founder.ability_previous","founder.ability_next","founder.interact","founder.activate_ability","ui.open_city","ui.open_command","ui.tactical_pause","ui.back"]},
    {"id":"command_hud","displayName":"Command HUD","assetPath":"/Game/UI/HUD/WBP_CommandHUD","widgetClass":"/Script/DominionUI.DACommandHUDWidget","layer":"hud","inputContextId":"ui.command","inputMode":"game_and_ui","entryFocusTarget":"radial.squad_selector","backTarget":"founder_hud","dataChannels":["command.selected_squads","command.control_zones","command.supply","quest.objective","command.enemy_known_positions","command.command_points","command.sovereignty","founder.status","command.tactical_alert"],"campaignCriticalActions":["command.squad_previous","command.squad_next","command.select_squad","command.issue_order","ui.open_founder","ui.tactical_pause","ui.back"]},
    {"id":"card_collection","displayName":"Card Collection","assetPath":"/Game/UI/Screens/WBP_CardCollection","widgetClass":"/Script/DominionUI.DAGrayboxScreenWidget","layer":"panel","inputContextId":"ui.city","inputMode":"ui_only","entryFocusTarget":"grid.first_card","backTarget":"city_hud","dataChannels":["collection.instances","collection.acquisition_audit","tooltip.simulation_trace"],"campaignCriticalActions":["collection.inspect_card","ui.back"]},
    {"id":"deck_builder","displayName":"Deck Builder","assetPath":"/Game/UI/Screens/WBP_DeckBuilder","widgetClass":"/Script/DominionUI.DAGrayboxScreenWidget","layer":"panel","inputContextId":"ui.city","inputMode":"ui_only","entryFocusTarget":"list.deck_first_card","backTarget":"card_collection","dataChannels":["deck.authoritative_state","deck.rule_results","tooltip.simulation_trace"],"campaignCriticalActions":["deck.add_card","deck.remove_card","deck.save","ui.back"]},
    {"id":"card_inspect","displayName":"Card Inspect / 3D Inspect","assetPath":"/Game/UI/Screens/WBP_CardInspect","widgetClass":"/Script/DominionUI.DAGrayboxScreenWidget","layer":"panel","inputContextId":"ui.city","inputMode":"ui_only","entryFocusTarget":"button.rotate_left","backTarget":"card_collection","dataChannels":["collection.selected_instance","tooltip.simulation_trace"],"campaignCriticalActions":["card.inspect_rotate","ui.back"]},
    {"id":"blueprint_crafting","displayName":"Blueprint / Crafting","assetPath":"/Game/UI/Screens/WBP_BlueprintCrafting","widgetClass":"/Script/DominionUI.DAGrayboxScreenWidget","layer":"panel","inputContextId":"ui.city","inputMode":"ui_only","entryFocusTarget":"list.first_blueprint","backTarget":"city_hud","dataChannels":["crafting.blueprints","crafting.authoritative_requirements","tooltip.simulation_trace"],"campaignCriticalActions":["crafting.craft","ui.back"]},
    {"id":"building_inspect","displayName":"Building Inspect","assetPath":"/Game/UI/Screens/WBP_BuildingInspect","widgetClass":"/Script/DominionUI.DAGrayboxScreenWidget","layer":"panel","inputContextId":"ui.city","inputMode":"game_and_ui","entryFocusTarget":"tab.status","backTarget":"city_hud","dataChannels":["world_asset.record","economy.facility_output_trace","utility.authority"],"campaignCriticalActions":["building.track","ui.back"]},
    {"id":"citizen_inspect","displayName":"Citizen Inspect","assetPath":"/Game/UI/Screens/WBP_CitizenInspect","widgetClass":"/Script/DominionUI.DAGrayboxScreenWidget","layer":"panel","inputContextId":"ui.city","inputMode":"ui_only","entryFocusTarget":"tab.profile","backTarget":"city_hud","dataChannels":["citizen.authoritative_record","jobs.openings","citizen.relationship_reason_ledger"],"campaignCriticalActions":["citizen.assign_job","ui.back"]},
    {"id":"faction_panel","displayName":"Faction Panel","assetPath":"/Game/UI/Screens/WBP_FactionPanel","widgetClass":"/Script/DominionUI.DAGrayboxScreenWidget","layer":"panel","inputContextId":"ui.city","inputMode":"ui_only","entryFocusTarget":"list.first_faction","backTarget":"city_hud","dataChannels":["factions.authoritative_state","factions.support_reason_ledger"],"campaignCriticalActions":["faction.open_diplomacy","ui.back"]},
    {"id":"diplomacy","displayName":"Diplomacy","assetPath":"/Game/UI/Screens/WBP_Diplomacy","widgetClass":"/Script/DominionUI.DAGrayboxScreenWidget","layer":"panel","inputContextId":"ui.world_map","inputMode":"ui_only","entryFocusTarget":"list.first_relationship","backTarget":"faction_panel","dataChannels":["diplomacy.relationships","diplomacy.relationship_reason_ledger"],"campaignCriticalActions":["diplomacy.open_treaty","ui.back"]},
    {"id":"treaty_builder","displayName":"Treaty Builder","assetPath":"/Game/UI/Screens/WBP_TreatyBuilder","widgetClass":"/Script/DominionUI.DAGrayboxScreenWidget","layer":"panel","inputContextId":"ui.world_map","inputMode":"ui_only","entryFocusTarget":"list.first_term","backTarget":"diplomacy","dataChannels":["treaty.authoritative_terms","treaty.term_reason_ledger"],"campaignCriticalActions":["treaty.commit","ui.back"]},
    {"id":"world_map","displayName":"World Map","assetPath":"/Game/UI/Screens/WBP_WorldMap","widgetClass":"/Script/DominionUI.DAGrayboxScreenWidget","layer":"panel","inputContextId":"ui.world_map","inputMode":"game_and_ui","entryFocusTarget":"region.synara_frontier","backTarget":"city_hud","dataChannels":["world.regions","world.trade_corridors","world_map.authority_reason_ledger"],"campaignCriticalActions":["world.travel","ui.back"]},
    {"id":"quest_journal","displayName":"Quest Journal","assetPath":"/Game/UI/Screens/WBP_QuestJournal","widgetClass":"/Script/DominionUI.DAGrayboxScreenWidget","layer":"panel","inputContextId":"ui.menu","inputMode":"ui_only","entryFocusTarget":"list.first_quest","backTarget":"city_hud","dataChannels":["narrative.quest_states","narrative.objective_bindings"],"campaignCriticalActions":["quest.track","ui.back"]},